{
    "$schema": "https://json-schema.org/draft/2020-12/schema",
    "type": "object",
    "properties": {
        "trafficLightQuestions": {
            "type": "array",
            "items": {
                "type": "object",
                "properties": {
                    "rank": {
                        "type": "number",
                        "minimum": 1,
                        "multipleOf": 1
                    },
                    "label": {
                        "type": "string"
                    },
                    "isRequired": {
                        "type": "boolean"
                    },
                    "visibility": {
                        "type": "string",
                        "enum": [
                            "both",
                            "manager",
                            "employee"
                        ]
                    },
                    "trafficLightOptions": {
                        "type": "array",
                        "items": {
                            "type": "object",
                            "properties": {
                                "rank": {
                                    "type": "number",
                                    "minimum": 1,
                                    "multipleOf": 1
                                },
                                "label": {
                                    "type": "string"
                                },
                                "colour": {
                                    "type": "string",
                                    "enum": [
                                        "red",
                                        "yellow",
                                        "green"
                                    ]
                                }
                            },
                            "required": [
                                "rank",
                                "label",
                                "colour"
                            ]
                        }
                    },
                    "answer": {
                        "type": "number",
                        "minimum": 1,
                        "multipleOf": 1
                    }
                },
                "required": [
                    "rank",
                    "label",
                    "isRequired",
                    "visibility",
                    "trafficLightOptions"
                ]
            }
        },
        "openTextQuestions": {
            "type": "array",
            "items": {
                "type": "object",
                "properties": {
                    "rank": {
                        "type": "number",
                        "minimum": 1,
                        "multipleOf": 1
                    },
                    "isRequired": {
                        "type": "boolean"
                    },
                    "label": {
                        "type": "string"
                    },
                    "visibility": {
                        "type": "string",
                        "enum": [
                            "both",
                            "manager",
                            "employee"
                        ]
                    },
                    "answer": {
                        "type": "string"
                    }
                },
                "required": [
                    "rank",
                    "isRequired",
                    "label",
                    "visibility"
                ]
            }
        },
        "multipleChoiceQuestions": {
            "type": "array",
            "items": {
                "type": "object",
                "properties": {
                    "rank": {
                        "type": "number",
                        "minimum": 1,
                        "multipleOf": 1
                    },
                    "isRequired": {
                        "type": "boolean"
                    },
                    "label": {
                        "type": "string"
                    },
                    "visibility": {
                        "type": "string",
                        "enum": [
                            "both",
                            "manager",
                            "employee"
                        ]
                    },
                    "multipleChoiceOptions": {
                        "type": "array",
                        "items": {
                            "type": "object",
                            "properties": {
                                "rank": {
                                    "type": "number",
                                    "minimum": 1,
                                    "multipleOf": 1
                                },
                                "label": {
                                    "type": "string"
                                }
                            },
                            "required": [
                                "rank",
                                "label"
                            ]
                        }
                    },
                    "answer": {
                        "type": "number",
                        "minimum": 1,
                        "multipleOf": 1
                    }
                },
                "required": [
                    "rank",
                    "isRequired",
                    "label",
                    "visibility",
                    "multipleChoiceOptions"
                ]
            }
        },
        "ratingScaleQuestions": {
            "type": "array",
            "items": {
                "type": "object",
                "properties": {
                    "rank": {
                        "type": "number",
                        "minimum": 1,
                        "multipleOf": 1
                    },
                    "label": {
                        "type": "string"
                    },
                    "isRequired": {
                        "type": "boolean"
                    },
                    "visibility": {
                        "type": "string",
                        "enum": [
                            "both",
                            "manager",
                            "employee"
                        ]
                    },
                    "columns": {
                        "type": "array",
                        "items": {
                            "type": "object",
                            "properties": {
                                "rank": {
                                    "type": "number",
                                    "minimum": 1,
                                    "multipleOf": 1
                                },
                                "label": {
                                    "type": "string"
                                }
                            },
                            "required": [
                                "rank",
                                "label"
                            ]
                        }
                    },
                    "rows": {
                        "type": "array",
                        "items": {
                            "type": "object",
                            "properties": {
                                "rank": {
                                    "type": "number",
                                    "minimum": 1,
                                    "multipleOf": 1
                                },
                                "label": {
                                    "type": "string"
                                }
                            },
                            "required": [
                                "rank",
                                "label"
                            ]
                        }
                    },
                    "answer": {
                        "type": "array",
                        "items": {
                            "type": "object",
                            "properties": {
                                "columnRank": {
                                    "type": "number",
                                    "minimum": 1,
                                    "multipleOf": 1
                                },
                                "rowRank": {
                                    "type": "number",
                                    "minimum": 1,
                                    "multipleOf": 1
                                }
                            },
                            "required": [
                                "columnRank",
                                "rowRank"
                            ]
                        }
                    }
                },
                "required": [
                    "rank",
                    "label",
                    "isRequired",
                    "visibility",
                    "columns",
                    "rows"
                ]
            }
        },
        "binaryQuestions": {
            "type": "array",
            "items": {
                "type": "object",
                "properties": {
                    "rank": {
                        "type": "number",
                        "minimum": 1,
                        "multipleOf": 1
                    },
                    "isRequired": {
                        "type": "boolean"
                    },
                    "label": {
                        "type": "string"
                    },
                    "visibility": {
                        "type": "string",
                        "enum": [
                            "both",
                            "manager",
                            "employee"
                        ]
                    },
                    "binaryOptions": {
                        "type": "array",
                        "items": {
                            "type": "object",
                            "properties": {
                                "label": {
                                    "type": "string"
                                },
                                "rank": {
                                    "type": "number",
                                    "minimum": 1,
                                    "multipleOf": 1
                                }
                            },
                            "required": [
                                "label",
                                "rank"
                            ]
                        }
                    },
                    "answer": {
                        "type": "number",
                        "minimum": 1,
                        "multipleOf": 1
                    }
                },
                "required": [
                    "rank",
                    "isRequired",
                    "label",
                    "visibility",
                    "binaryOptions"
                ]
            }
        }
    },
    "required": [
        "trafficLightQuestions",
        "openTextQuestions",
        "multipleChoiceQuestions",
        "ratingScaleQuestions",
        "binaryQuestions"
    ]
}
  
  
  